[
  {
    "contract_version": "1.0",
    "event_id": "exposure_holdout_0001",
    "tenant_id": "bank_1",
    "experiment_id": "connected_growth_01",
    "household_token": "tok_holdout_00000001",
    "arm": "holdout",
    "decision_evaluated": false,
    "action_delivered": false,
    "connected_data_used": false,
    "authorization_scope_id": "scope_consumer_wealth_01",
    "decision_protocol_id": "merrill_growth_protocol_v1",
    "occurred_at": "2026-07-02T00:00:00.000Z"
  },
  {
    "contract_version": "1.0",
    "event_id": "exposure_standalone_0001",
    "tenant_id": "bank_1",
    "experiment_id": "connected_growth_01",
    "household_token": "tok_standalone_00000001",
    "arm": "standalone",
    "decision_evaluated": true,
    "action_delivered": true,
    "connected_data_used": false,
    "authorization_scope_id": "scope_consumer_wealth_01",
    "decision_protocol_id": "merrill_growth_protocol_v1",
    "occurred_at": "2026-07-02T00:00:00.000Z"
  },
  {
    "contract_version": "1.0",
    "event_id": "exposure_connected_0001",
    "tenant_id": "bank_1",
    "experiment_id": "connected_growth_01",
    "household_token": "tok_connected_00000001",
    "arm": "connected",
    "decision_evaluated": true,
    "action_delivered": false,
    "connected_data_used": true,
    "authorization_scope_id": "scope_consumer_wealth_01",
    "decision_protocol_id": "merrill_growth_protocol_v1",
    "occurred_at": "2026-07-02T00:00:00.000Z"
  }
]
